category,issue_description,ticket_number
Shipping Route Change,"Shipping route changes have resulted in several challenges, including erratic variations, delivery delays, and increased fuel consumption. Inconsistent route assignments and unauthorized alterations have led to disruptions in delivery schedules and elevated transportation costs. Additionally, there have been instances of unplanned deviations from optimized routes, causing inefficiencies in the delivery process.

To address these issues, it is recommended to implement a more robust route management system that ensures consistent use of optimized routes. This system should minimize route changes unless necessary and monitor fuel consumption and transportation costs closely. Furthermore, it is essential to establish clear communication channels to ensure that all stakeholders are informed of any route changes in a timely manner to minimize delivery disruptions. By taking these steps, it is possible to resolve the current issues and improve the overall efficiency of the shipping process.",35f9f1b
Shipping Route Change,"Shipping Route Change Issues: A Comprehensive Analysis

The identified issues related to shipping route changes include unexpected alterations, frequent modifications, inconsistent assignments, increased fuel consumption, unexplained deviations, delivery schedule disruptions, inefficient changes, unauthorized alterations, and higher transportation costs. These problems may stem from inadequate route optimization, poor communication, or lack of adherence to established protocols.

To address these challenges, it is recommended to implement a robust route optimization system, ensure clear communication channels, and enforce strict compliance with approved shipping routes. Additionally, regular audits of route changes and their impact on delivery times and costs can help identify patterns and areas for improvement. By taking these steps, it is possible to minimize the negative impacts of shipping route changes and improve overall efficiency and profitability.",929ff03
Shipping Route Change,"Shipping Route Change: Identified Issues and Proposed Resolution

A comprehensive review of shipping operations has revealed several concerns related to route changes. These include sudden shifts mid-transit, frequent adjustments causing delays, inconsistent assignments, and unauthorized alterations. These changes have resulted in increased fuel usage, disrupted delivery schedules, and elevated transportation costs.

The root cause of these issues appears to be a lack of standardized procedures for route planning and modification. This inconsistency has led to inefficient route changes, negatively impacting delivery times and overall operational efficiency.

To address these challenges, we recommend implementing a centralized route management system. This system would ensure the consistent use of optimized routes, minimizing sudden changes and reducing fuel consumption. Additionally, establishing clear guidelines for route adjustments and communication protocols for unexpected deviations would help maintain delivery schedules and reduce disruptions.",3c85afd
Shipping Route Change,"Shipping Route Change: Identified Issues and Potential Resolutions

The current shipping route management exhibits several challenges, including abrupt route changes, frequent adjustments, and inconsistent allocation. These issues lead to delivery delays, increased fuel consumption, and inflated transportation costs. Unplanned deviations and unauthorized modifications also contribute to the disturbance of delivery schedules and inefficient route usage.

To address these concerns, a comprehensive review of the route change policy is necessary. This review should focus on promoting consistency, minimizing abrupt changes, and ensuring authorized modifications only. Implementing an optimized route allocation system, utilizing real-time data and predictive analytics, can help reduce fuel consumption and transportation costs.

Additionally, providing clear communication channels for reporting unauthorized modifications and establishing a feedback system for delivery personnel can help maintain the integrity of the shipping routes. Regular audits of the route change policy and its implementation can ensure continuous improvement and adaptation to changing circumstances.",574f556
Shipping Route Change,"Shipping Route Change Issues: A Comprehensive Analysis

The unforeseen shifts in shipping routes have led to a multitude of challenges, including frequent route changes causing delays, inconsistent route assignments, and unplanned deviations. These issues have resulted in increased fuel consumption, disrupted delivery schedules, and higher transportation costs. Moreover, there have been instances of inconsistent application of optimized shipping routes and unauthorized alterations, further exacerbating the problem.

To address these concerns, it is crucial to implement a robust route management system that can minimize route changes and ensure consistent application of optimized routes. This system should be capable of predicting potential route shifts and providing real-time updates to minimize delays and disruptions. Additionally, implementing strict protocols for route changes and monitoring unauthorized alterations can help maintain the integrity of the shipping routes. By taking these steps, it is possible to resolve the existing issues and ensure efficient and cost-effective shipping operations.",f7ce022
Shipping Route Change,"Shipping Route Change: Identified Issues and Potential Resolutions

The identified issues related to shipping route changes include unanticipated route changes during transit, frequent route modifications causing delays, inconsistent shipping route assignments, and unplanned deviations from shipping routes. These changes lead to increased fuel consumption, disruption of delivery schedules, inefficient route changes affecting delivery times, and higher transportation costs. Unauthorized shipping route alterations and inconsistent application of optimized shipping routes further exacerbate the problem.

To address these issues, a comprehensive review of the current route assignment and modification process is necessary. Implementing a more robust and consistent route optimization strategy, coupled with real-time monitoring and alert systems, can help minimize unplanned deviations and reduce the frequency of route changes. Additionally, establishing clear communication channels and protocols for authorized route modifications can help prevent unauthorized alterations and ensure timely delivery.",60474d9
Shipping Route Change,"Shipping Route Change Issues:

1. Unexplained mid-transit route shifts: These unexpected changes can lead to delays, increased fuel consumption, and disrupted delivery schedules.
2. Frequent route changes: The inconsistency in route assignments can cause delays and raise transportation costs.
3. Inconsistent use of optimized routes: This issue results in inefficient route changes, affecting delivery times and increasing fuel consumption.
4. Unauthorized shipping route alterations: These changes can lead to unanticipated deviations from shipping routes, causing disruptions in delivery schedules and raising transportation costs.
5. Route changes increasing fuel consumption: This problem can be attributed to the use of less efficient routes, leading to higher transportation costs.

Potential Resolution:

To address these issues, a comprehensive review of the route assignment and change protocols is necessary. Implementing a more transparent and consistent system for route changes, ensuring the use of optimized routes, and restricting unauthorized alterations can help improve delivery times, reduce fuel consumption, and lower transportation costs.",4c69041
Shipping Time Discrepancy,"Shipping Time Discrepancy: A Comprehensive Analysis

1. Delivery time deviates from estimate: This issue arises when actual delivery times do not align with projected estimates, causing customer dissatisfaction.

2. Unanticipated transit delays: Unexpected delays during transit, such as weather-related disruptions or logistical issues, can significantly impact delivery times.

3. Regional delivery time variations: Differences in delivery times across various regions can be attributed to factors like infrastructure, distance, and local regulations.

4. Packages delivered ahead of schedule: While seemingly positive, early deliveries can disrupt customers' plans and create inconsistencies in service quality.

5. Extended international shipping times: Cross-border deliveries often face prolonged transit times due to customs clearance, inspections, and longer distances.

6. Faulty package tracking data: Inaccurate or delayed tracking information can lead to confusion and mistrust among customers.

7. Delivery time falls short of expectations: When delivery times fail to meet customer expectations, it can result in negative feedback and potential loss of business.

",6447016
Missing Items,"Delivery Issue: Incomplete or Missing Items

The recipient has reported an issue with their delivery, stating that multiple items are absent from the shipment. This problem may be due to packaging errors, incorrect picking, or inventory management issues.

To address this concern, it is recommended to conduct an internal investigation to identify the root cause. This may involve reviewing CCTV footage, checking inventory records, and communicating with the warehouse team.

If the investigation confirms that the items were indeed missing from the shipment, the appropriate resolution would be to send the missing items to the recipient as soon as possible. Additionally, it may be necessary to review and improve the current packaging and picking processes to prevent similar issues from occurring in the future.

In the case of a tampered package, it is crucial to report the incident to the carrier and file a claim if necessary. It is also essential to review the security measures in place during the delivery process to prevent future incidents.

In all cases, it is crucial to maintain open communication with the",c41e822
Missing Items,"Subject: Shipment Issue - Missing Items and Potential Resolution

We have identified several instances where delivered packages contained fewer items than listed on the manifest, or items were entirely absent. This issue may be due to packaging errors, mishandling during transit, or incorrect delivery. To address this, we recommend implementing a rigorous quality control process during packaging and collaborating with logistics providers to ensure safe and accurate delivery. Additionally, it may be beneficial to review and update the packaging process to prevent tampering and ensure the security of the items during transit.",61b4312
Missing Items,"Issue: Incomplete delivery and missing items reported by the recipient. Tracking indicates delivery, but the recipient claims non-receipt. Partial orders received, with the rest missing. Packages delivered empty, open, or to the wrong address. Some recipients report seal tampering.

Potential resolution: Investigate delivery processes, including packaging, handling, and tracking. Verify delivery information and addresses. Consider additional security measures to prevent tampering. Communicate with recipients to confirm delivery and address concerns. Implement stricter quality control measures for order fulfillment and packaging. Consider insurance or replacement policies for missing or damaged items.",1565cda
Missing Items,"Subject: Issue Report - Delivery Discrepancies and Missing Items

We have identified several instances of delivery discrepancies, including partial deliveries, missing items, and packages delivered to incorrect addresses. These issues appear to be related to insufficient packaging, mishandling during transit, or errors in the shipping process.

To address these concerns, we recommend implementing the following steps:

1. Conduct a thorough investigation of the reported cases to identify the root causes.
2. Review and enhance packaging guidelines to ensure the security of items during transit.
3. Train logistics personnel on proper handling and shipping procedures.
4. Implement a robust tracking system to monitor packages from dispatch to delivery.
5. Establish a clear communication channel with recipients to promptly address any delivery issues.

By taking these actions, we can minimize delivery discrepancies and ensure customer satisfaction.",f8fac2d
Missing Items,"In recent deliveries, several discrepancies have been reported, including incomplete deliveries, missing items, and unsealed packages. In some instances, tracking information indicates delivery, but recipients claim otherwise. There are also cases where packages have been delivered to incorrect addresses or found empty. A few recipients have reported suspicions of tampered seals.

These issues suggest a pattern of problems related to missing items and package security. To address these concerns, it is recommended to conduct a thorough investigation of the delivery process, including packaging, transportation, and delivery confirmation. Additionally, it may be beneficial to implement stricter quality control measures and provide additional training to delivery personnel. A review of the inventory management system may also be necessary to ensure accuracy in order tracking and delivery.",0d04d39
Missing Items,"Issue: Incomplete delivery with missing items and potential tampering.

Description: A package has been delivered, but the recipient reports that it is incomplete and shows signs of tampering. The tracking information indicates a partial delivery, and the recipient claims that some items are missing from the order. There is a discrepancy between the delivery confirmation and the recipient's account.

Potential Resolution: It is recommended to investigate the delivery process, including the handling and transportation of the package. The shipper should verify the accuracy of the manifest and compare it with the delivered items. If tampering is suspected, it may be necessary to review security footage or consult with the carrier. The shipper should consider sending replacement items or issuing a refund to the recipient, depending on the outcome of the investigation.",6cf8a01
Missing Items,"Delivery Issue: Incomplete Shipment & Missing Items

A review of the delivery reveals several discrepancies between the ordered items and the received package. The shipment appears to have been partially delivered, with multiple items absent from the delivery. This issue is closely related to the category of 'Missing Items.'

Upon inspection, the delivered package was found empty, indicating a potential problem during the packaging or shipping process. The tracking information suggests that the package was delivered to an incorrect address, which could explain the missing items.

To resolve this issue, we recommend the following steps:

1. Verify the delivery address and ensure it matches the intended location.
2. Conduct an internal investigation to determine the cause of the missing items.
3. Provide the recipient with a full refund or replacement of the missing items.
4. Implement additional quality control measures to prevent similar issues in the future.

By addressing these concerns, we can ensure a more efficient and reliable delivery process, ultimately leading to increased customer satisfaction.",3166f7a
Missing Items,"Delivery issues have been reported, including missing items, unsealed packages, incorrect delivery locations, and disputes from recipients. These incidents suggest a pattern of problems related to package integrity and accuracy of delivery.

To address these concerns, a thorough investigation is recommended. This should include a review of delivery procedures, packaging processes, and tracking systems. It may also be necessary to examine the handling of packages at distribution centers and during transit.

Potential resolutions could involve implementing stricter quality control measures, providing additional training for delivery personnel, and upgrading tracking systems to ensure real-time visibility into package locations. Furthermore, it may be beneficial to establish a dedicated customer service team to handle delivery disputes and complaints, ensuring timely and effective resolution of issues.",ddaebc2
Package Delivery Issue,"Package Delivery Issue: Delayed notification of delivery, damaged package, incorrect address, missing items, failed delivery attempts, lost in transit, unauthorized refusal, wrong recipient, and undelivered package marked as delivered.

These issues suggest a breakdown in the delivery process, potentially due to logistical errors, handling mishaps, or communication failures. To resolve these problems, it's recommended to:

1. Investigate the root cause of each issue.
2. Implement corrective actions to prevent recurrence.
3. Communicate with the affected parties, providing updates and next steps.
4. Consider compensation or replacement for damaged or lost packages.
5. Review and update delivery protocols, training, and communication channels.

By addressing these concerns, package delivery services can improve customer satisfaction and operational efficiency.",3380a62
Package Delivery Issue,"Package Delivery Issues:

1. Incomplete package contents: This may be due to errors in packaging or inventory management. A potential resolution is to implement stricter quality control measures and improve inventory tracking.

2. Delayed delivery with no update: This could be caused by inefficiencies in the delivery process or lack of communication. Providing real-time tracking and regular updates to customers can help mitigate this issue.

3. Package delivered to incorrect location: This may be a result of human error or system glitches. Implementing a more robust address verification system can prevent such mistakes.

4. Recipient unable to refuse unauthorized delivery: This could be addressed by providing customers with the option to verify and confirm deliveries before they are completed.

5. Package marked as delivered but not received: This may be due to miscommunication between the delivery personnel and the system. Regular training and updates for delivery personnel can help resolve this.

6. Delivery vehicle breakdown causing delay: Regular maintenance and updates of delivery vehicles can help prevent breakdowns and ensure",f294090
Package Delivery Issue,"Issue: Late package arrival due to traffic congestion and delivery vehicle involved in an accident causing delay. Potential resolution: Implement real-time traffic monitoring and route optimization systems to mitigate delays. Develop contingency plans for accidents, such as backup vehicles or alternative delivery methods.

Issue: Package contents partially missing. Potential resolution: Investigate packaging processes and handling procedures to ensure the integrity of package contents. Implement stricter quality control measures and provide additional training to staff.

Issue: Delivery to an outdated address. Potential resolution: Regularly update and verify customer address information. Implement a confirmation system for delivery addresses.

Issue: Recipient unavailability leading to delivery failure. Potential resolution: Offer flexible delivery options, such as rescheduling or alternative pickup locations. Encourage customers to provide delivery instructions for instances when they are not available.

Issue: Package delayed due to sorting errors. Potential resolution: Improve sorting automation and quality control measures. Provide additional training to staff responsible for sorting and handling packages.

Issue: Delivery delayed due to peak season volume.",1af6408
Shipping Label Error,"Shipping Label Error Report:

1. Inconsistent format of shipping labels: This issue may arise due to the use of multiple label templates or non-compliance with carrier-specific design standards. To resolve this, implement a standardized label format and ensure adherence to carrier guidelines.

2. Mismatched shipment contents and label description: This problem can be addressed by improving the accuracy of order picking and packing processes, as well as implementing a quality control check before shipment.

3. Outdated or incorrect return address on label: Regularly update and verify return address information in the shipping system to prevent this issue.

4. Absence of required customs documentation: Ensure that the shipping system is configured to generate necessary customs documents for international shipments.

5. Use of non-compliant label materials: Switch to carrier-approved label materials to avoid potential delivery issues.

6. Incorrectly labeled hazardous materials: Provide training to staff on proper hazardous materials labeling and handling procedures.

7. Missing required package orientation indicators: Update the shipping system to automatically",089cab6
Shipping Label Error,"Shipping Label Error Report:

1. Recipient address mismatch: The shipping label displays an incorrect recipient address, causing delivery to the wrong location. Resolution: Verify the correct address and generate a new label.
2. Missing shipment tracking number: The absence of a tracking number hinders package monitoring. Resolution: Ensure tracking numbers are included in future labels.
3. Illegible or smudged label: The label's text is difficult to read, risking misinterpretation. Resolution: Print labels clearly and use smudge-proof materials.
4. Inaccurate weight or dimensions: The listed package weight and dimensions are incorrect, leading to potential delivery issues. Resolution: Double-check measurements before creating labels.
5. Incorrect delivery date for time-sensitive shipments: The label indicates an incorrect delivery date, causing delays. Resolution: Confirm delivery dates and communicate with shipping carriers.
6. Incomplete or missing sender information: The label lacks essential sender details, complicating returns or inquiries. Resolution: Include complete sender information on",24daab5
Shipping Label Error,"Shipping Label Error Report:

Upon review, several issues were identified with the current shipping labels. These include inaccurate recipient addresses, missing tracking numbers, smudged or illegible labels, incorrect package dimensions, outdated return addresses, absent customs documentation, noncompliant label materials, mislabelled hazardous materials, and missing package orientation indicators. Additionally, some labels feature outdated company logos.

These issues may lead to delivery delays, misdeliveries, or non-compliance with shipping regulations. To resolve these problems, it is recommended to update the recipient addresses, include tracking numbers, ensure label legibility, verify package dimensions, update return addresses, provide customs documentation, use compliant label materials, accurately label hazardous materials, include package orientation indicators, and update company logos on all labels. Regular audits and quality checks can help prevent similar issues in the future.",262f231
Damaged Package,"Package exhibits multiple signs of damage, including deep scratches, crushed corners, torn wrapping, dented edges, loose contents, stained exterior, torn flap, bent sides, dirty markings, and tampered tape. These issues suggest rough handling during transit, exposure to harsh conditions, or improper storage. The extent of the damage may compromise the package's contents, necessitating a thorough inspection. To mitigate potential losses, it is recommended to review handling procedures, reinforce packaging materials, and consider using shock and vibration indicators for sensitive items. Additionally, implementing a quality control process to inspect packages before dispatch can help reduce the likelihood of damage.",865f61e
Damaged Package,"Package exhibits several issues, including deep indentations, visible scratches, water damage, partial opening, crushing marks, rattling sound, broken seal, signs of rough handling, and puncture marks. The label is also illegible or damaged. These issues suggest potential damage to the contents and may impact the package's integrity. It is recommended to inspect the contents carefully and document any damage for insurance or replacement purposes. The package's handling should be improved to prevent similar issues in the future, including better protection, waterproofing, and careful handling. The seal should be intact, and the label should be clear and legible.",7b11859
Damaged Package,"Subject: Detailed Inspection Report - Package Damage

Upon thorough examination, the package exhibits several issues:

1. Gouges on the exterior, indicating rough handling during transit.
2. Contents shifted or misaligned, suggesting insufficient internal protection.
3. Frayed edges, possibly due to wear and tear from previous usage.
4. Bent corners, potentially from impact or pressure during delivery.
5. Torn lining, possibly caused by sharp or heavy items inside the package.
6. Stained interior, indicating possible exposure to moisture or contaminants.
7. Loose tape, suggesting inadequate sealing or adhesive failure.
8. Dented bottom, possibly from dropping or stacking heavy items on top.
9. Smudged markings, potentially obscuring important package information.
10. Tampered packaging, raising concerns about the package's integrity and security.

To address these issues, we recommend:

1. Reinforcing the package exterior with durable materials.
2. Improving internal protection with cushioning or bracing.
3. Re",d4ea202
