category,issue_description,ticket_number
Delayed Delivery,"Delayed delivery issues can arise from various factors, including routing problems, unforeseen circumstances, vehicle breakdowns, and weather conditions. These situations can lead to packages being marked as ""out for delivery"" but not received, or stuck in transit for extended periods with no estimated time of arrival. In some cases, there may be a lack of communication from the company regarding the delay.

To address these issues, companies can implement real-time tracking systems to keep customers informed of their package's location and estimated delivery time. Additionally, investing in robust routing software and maintaining vehicles can help prevent delays due to routing issues and vehicle breakdowns. In cases of weather-related delays, companies can provide customers with alternative delivery options or compensation for the inconvenience.

Overall, proactive communication, investment in technology, and contingency planning can help mitigate delayed delivery issues and improve customer satisfaction.",ff92972
Delayed Delivery,"Issue: Prolonged package inactivity at sorting facility, leading to Delayed Delivery. 

Analysis: The primary concern is the extended dwell time of packages at sorting facilities, which causes significant delivery delays. This issue may be attributed to several factors, including inefficient sorting processes, staffing shortages, or logistical challenges in transportation.

Potential Resolution: To address this problem, a comprehensive review of the sorting facility's operations is recommended. This review should identify bottlenecks in the sorting process and evaluate staffing levels and resource allocation. Implementing automated sorting systems or optimizing transportation routes may also help reduce package dwell time and expedite delivery.

Next Steps: Begin by conducting a thorough assessment of the sorting facility's operations. Engage with staff to understand their perspectives and gather insights. Based on the findings, develop a plan to improve sorting efficiency, address staffing needs, and optimize transportation. Monitor the implementation of these changes and evaluate their impact on package dwell time and delivery speed.",4107dfa
Delayed Delivery,"Delayed Delivery: An In-depth Analysis of Common Issues and Potential Resolutions

1. Extended delay at distribution center: This may be due to inefficiencies in sorting or scanning processes, or unforeseen logistical challenges. Implementing advanced automation technologies and improving operational workflows can help expedite package processing.

2. Delivery truck delayed en route: Factors such as traffic, road conditions, or vehicle malfunctions can cause delays. Real-time traffic updates, regular vehicle maintenance, and optimized routing can minimize these occurrences.

3. Package held up in customs: Delays may arise from insufficient documentation, customs inspections, or duty payment issues. Ensuring accurate and complete customs paperwork can expedite the clearance process.

4. Unanticipated delivery route changes: Factors like weather, construction, or accidents can disrupt routes. Advanced route planning and real-time traffic updates can help drivers navigate around obstacles.

5. Delay due to insufficient staffing: Peak seasons or unexpected absences can strain resources. Implementing flexible staffing models and cross-training employees can",258b325
Delayed Delivery,"Issue: Prolonged package inactivity at hub due to insufficient staffing and unforeseen delivery route changes. This has resulted in no delivery progress updates, delayed delivery with no ETA, and packages being held up in customs or misplaced during transit.

Analysis: The primary cause of these delays appears to be staffing shortages and unexpected route changes, which have led to a backlog of packages at the hub. This has caused a ripple effect, leading to further delays and a lack of visibility into the delivery process.

Potential Resolution: To address these issues, it is recommended that the company increase staffing levels at the hub and implement a more robust system for managing delivery routes. This could include real-time tracking and communication tools to keep customers informed of any changes or delays. Additionally, the company should consider implementing a process for regularly auditing packages in transit to prevent misplacement and ensure timely delivery.",45a31ce
Shipping Partner Conflict,"In recent operations, several issues have emerged with our shipping partners. These include frequent delays in transit, mishandling of packages, erroneous invoicing, inability to accommodate oversized cargo, unresponsive communication channels, failure to provide required documentation, unavailability during critical shipping windows, and personnel lacking proper training. These problems have resulted in delays in warehouse operations and inconsistent delivery times.

The root causes of these issues may include inadequate training, poor communication, and insufficient resources. To address these challenges, we recommend implementing a comprehensive training program for partner personnel, establishing clear communication protocols, and investing in additional resources to ensure timely and efficient shipping. Regular audits of partner performance and invoicing practices may also help to identify and resolve any ongoing issues. By taking these steps, we can improve our shipping operations and strengthen our relationships with our partners.",8d7c5fd
Shipping Partner Conflict,"Shipping Partner Conflict: Inconsistent delivery times, failure to pick up shipments, damaged packages, vehicle breakdowns, unprofessional behavior, invoicing discrepancies, inability to handle special cargo, communication issues, non-compliance with regulations, and lack of availability during peak times have been reported.

These issues suggest a pattern of unreliable service and non-compliance with industry standards. The extent of the problems indicates a need for immediate action to prevent further disruptions and potential damage to the company's reputation.

Next steps:

1. Conduct a thorough review of the partnership agreement to identify any breaches and potential consequences.
2. Schedule a meeting with the partner to discuss the issues and seek resolutions.
3. Consider alternative partners if the current partner is unable or unwilling to address the problems.
4. Implement stricter monitoring and evaluation processes to ensure compliance with regulations and service level agreements.
5. Explore the possibility of in-house shipping capabilities to reduce reliance on external partners.",1dd27cf
Shipping Partner Conflict,"In recent interactions with our shipping partners, several issues have emerged that are causing disruptions in our supply chain. These include partners' vehicles frequently exceeding weight limits, personnel refusing to transport certain items, and delivery schedules clashing with ours. Additionally, partners' vehicles have caused damage to our facilities, and personnel have frequently changed pickup times, arrived with incomplete cargo, and lacked necessary equipment. Delivery times have also been inconsistent with agreements, and vehicles often arrive early, causing delays in loading and unloading.

These issues suggest a need for improved communication and coordination with our shipping partners. Potential resolutions could include establishing clearer guidelines for weight limits, transportable items, and delivery schedules, as well as providing additional training for personnel. Regular check-ins with partners could also help ensure that issues are addressed promptly and that both parties are aligned on expectations.",9e71c7f
Shipping Partner Conflict,"Shipping Partner Conflict: Detailed Issues Report

1. Frequent transit delays, potentially due to partners' vehicle management issues, causing disruptions in the supply chain.
2. Instances of package mishandling by partners' personnel, leading to damaged or lost goods, and customer dissatisfaction.
3. Inaccurate invoicing by the partner, resulting in financial discrepancies and administrative challenges.
4. Inability to handle special cargo, limiting the range of products that can be shipped and potentially affecting revenue.
5. Communication issues with the partner, causing misunderstandings and hindering efficient collaboration.
6. Non-compliance with regulations, posing legal risks and damaging the company's reputation.
7. Unavailability during peak times, straining resources and negatively impacting service levels.
8. Causing warehouse operation delays, reducing productivity and increasing costs.
9. Inconsistent delivery times, affecting customer satisfaction and trust.
10. Personnel lacking proper training, leading to errors and inefficiencies.

Potential Resolution:

Addressing these issues requires a comprehensive",36d608e
Shipping Partner Conflict,"Shipping Partner Conflict: Detailed Issues and Potential Resolution

The shipping partner has been consistently late in pickups, causing disruptions in the supply chain. Their vehicles frequently break down, leading to further delays and potential damage to packages. Personnel have been unresponsive to communication, and invoices have been inaccurate, causing financial strain. The partner is unable to handle hazardous materials, limiting shipping options. They have also violated transport regulations, posing legal risks. During high-volume periods, the partner is unavailable, and delivery times are inconsistent with estimates, causing customer dissatisfaction. Crossdock transfers have been delayed, impacting overall efficiency.

A potential resolution could be to re-evaluate the partnership and consider alternative shipping providers. Implementing stricter performance metrics and penalties for non-compliance could also encourage improvement. Additionally, providing training and resources to the partner's personnel may enhance their ability to handle hazardous materials and improve communication.",dfc5592
Shipping Fee Dispute,"Shipping Fee Disputes: An Analysis of Common Issues and Potential Resolutions

1. Weekend Shipping Fee Inconsistency: Disputes may arise due to varying weekend shipping rates. Resolution: Implement a clear, consistent weekend fee policy.

2. Holiday Surcharge: Fee disagreements can occur during holidays due to unexpected surcharges. Resolution: Communicate surcharge policies proactively to customers.

3. Remote Area Shipping Fee Discrepancy: Customers in remote areas may dispute fees due to higher costs. Resolution: Provide transparent information on remote area surcharges.

4. Dimensional Weight: Fee disagreements can stem from dimensional weight calculations. Resolution: Educate customers on dimensional weight and provide clear fee structures.

5. Hazardous Materials: Shipping fee disputes may occur for hazardous materials due to additional handling costs. Resolution: Clearly communicate hazardous materials fees and regulations.

6. Less-than-Truckload (LTL) Shipping: Fee discrepancies can arise in LTL shipping due to minimum weight requirements. Resolution:",b8d6ca7
Shipping Fee Dispute,"Shipping Fee Disputes: An Analysis of Common Issues and Potential Resolutions

1. Inconsistent shipping fee on weekends: This issue may arise due to varying weekend delivery policies among carriers. To resolve, standardize weekend delivery charges or clearly communicate differential pricing to customers.

2. Fee dispute due to holiday surcharge: Customers may object to holiday surcharges, especially if they're unexpected. To mitigate, provide advance notice of surcharges or consider absorbing them into the base shipping fee.

3. Discrepancy in shipping fee for remote areas: Remote locations often incur higher shipping costs. To address, offer transparent pricing that reflects actual costs or provide a flat-rate option for remote areas.

4. Fee disagreement caused by dimensional weight: Dimensional weight can lead to higher fees for lightweight but large items. To resolve, clearly communicate dimensional weight pricing and offer packaging suggestions to reduce size.

5. Shipping fee dispute for hazardous materials: Handling hazardous materials requires special care, leading to higher fees. To mitigate",a33a53b
Shipping Fee Dispute,"Issue: Mismatched shipping fees on mobile app and website.

The discrepancy in shipping fees displayed on the mobile app and website has resulted in customer confusion and complaints, leading to the ""Shipping Fee Dispute"" situation. This issue may be due to inconsistent updates or synchronization errors between the two platforms.

To resolve this problem, a thorough investigation of the pricing logic and update processes for both the mobile app and website is required. It is recommended to establish a unified pricing system or improve the synchronization mechanism to ensure consistent shipping fees across all platforms.

Next steps:

1. Investigate the root cause of the discrepancy.
2. Develop a unified pricing system or improve synchronization.
3. Test and validate the solution.
4. Communicate the resolution to affected customers.

By addressing this issue promptly, customer trust and satisfaction can be restored, avoiding further ""Shipping Fee Disputes.""",c1881a1
Shipping Fee Dispute,"Shipping Fee Dispute: A Comprehensive Analysis

1. Inconsistent Quoted Price: The invoice and receipt may display varying shipping fees, causing confusion and mistrust. To resolve, implement a real-time fee update system, ensuring quoted prices match the final invoice.

2. Undocumented Handling Fees: Customers may dispute fees due to undisclosed handling charges. To address, provide transparent fee breakdowns, including all handling fees, during the checkout process.

3. Fuel Surcharge Calculation: Discrepancies in fuel surcharge calculations can lead to fee disputes. To mitigate, utilize an accurate, up-to-date fuel surcharge calculation method, ensuring fairness and transparency.

4. Oversized Item Fee Calculation: Errors in calculating fees for oversized items can result in disputes. To prevent, employ a reliable dimension-based pricing system, accurately reflecting the actual shipping costs.

5. International Delivery Fees: Inaccurate fee calculations for international deliveries can cause disputes. To resolve, integrate a comprehensive international shipping fee calculator, considering all",482297e
Damaged Package,"Package in question exhibits several issues: severe creases, visible scratches, water stains, partial opening, crushing marks, rattling sound, broken seal, signs of rough treatment, and puncture marks. The label is also illegible or damaged. These problems suggest mishandling during transit, leading to potential damage to the contents.

A thorough inspection of the contents is necessary to assess the extent of the damage. If the contents are indeed damaged, it may be necessary to file a claim with the shipping company for compensation. Additionally, implementing stricter handling procedures and using more durable packaging materials may help prevent similar issues in the future.",0e39ba5
Damaged Package,"Package exhibits several issues, including deep indentations, visible scratches, water damage, partial opening, crushing marks, rattling sound, broken seal, signs of rough handling, and puncture marks. The label is also illegible or damaged. These issues suggest potential damage to the contents and may impact the package's integrity. It is recommended to inspect the contents carefully and document any damage for potential claims. The package may require repackaging or replacement depending on the extent of the damage. Additionally, it may be necessary to review handling procedures to prevent similar issues in the future.",332467b
Shipping Label Error,"Shipping Label Error Report:

1. Inconsistent label format: The label format varies across shipments, causing confusion and delays in processing. Recommend standardizing the label format for all shipments.
2. Mismatched shipment contents: The contents of the shipment do not match the description on the label. This can lead to incorrect handling and delivery. Recommend verifying the contents before shipping.
3. Outdated return address: The return address on the label is outdated, which can cause issues in case of returns. Recommend updating the return address to the current one.
4. Missing customs documents: For international shipments, customs documents are missing. This can lead to delays and fines. Recommend including all necessary customs documents.
5. Noncompliant label material: The label material does not meet carrier standards. Recommend using compliant label material to ensure durability and readability.
6. Mislabeling of hazardous materials: Hazardous materials are not properly labeled. This can lead to safety issues and fines. Recommend following hazardous material labeling regulations.
",d2ec250
Shipping Label Error,"Shipping Label Error Report:

Upon review, several issues were identified with the current shipping labels. These include incorrect recipient addresses, missing tracking numbers, illegible shipping labels, inaccurate package dimensions, outdated return addresses, absent customs documents, non-compliant label materials, mislabeled hazardous materials, and missing package orientation indicators. Additionally, some labels feature an outdated company logo.

These issues may lead to delivery delays, misdeliveries, or even safety hazards. To resolve these problems, it is recommended to update the recipient addresses, include tracking numbers, improve label legibility, ensure accurate package dimensions, update return addresses, include customs documents, use compliant label materials, correctly label hazardous materials, add package orientation indicators, and update the company logo on the labels. Regular audits and updates can help prevent similar issues in the future.",8a1b47c
Shipping Label Error,"Shipping Label Error Report:

1. Font size inconsistency: Verify printer settings and ensure compliance with shipping guidelines.
2. Missing label: Generate and affix a new label to the package.
3. Transposed digits: Verify tracking number accuracy and update if necessary.
4. Outdated contact information: Update company information in the label generation system.
5. Absent hazardous materials diamond label: Add the required label for compliance.
6. Fragile marking without proper labeling: Apply appropriate fragile labels to ensure proper handling.
7. Incorrect destination country: Confirm the shipping address and update the label if required.
8. Absent 'this side up' indicator: Add the indicator to ensure proper package orientation.
9. Outdated carrier logo: Update the logo in the label generation system.
10. Absent 'keep refrigerated' instruction: Add the instruction for proper package handling.

Potential resolution: Address each issue individually, ensuring compliance with shipping guidelines and proper package handling.",2416e67
Shipping Label Error,"Shipping Label Error Report:

1. Recipient address requires verification for accuracy.
2. Tracking number is either missing or illegible, necessitating a new label.
3. Label print quality is poor, with smudges affecting readability. Recommend reprinting.
4. Package weight and dimensions should be rechecked and updated if necessary.
5. Return address needs to be confirmed and updated if outdated or incorrect.
6. Customs information is absent or incorrect, requiring immediate attention.
7. Label material may not meet compliance standards. Suggest using approved materials.
8. Hazardous materials labeling appears incomplete or incorrect. Must be rectified before shipping.
9. Package orientation indicator is missing. Add appropriate markings for safe handling.
10. Company logo and contact information on the label are outdated. Update to current versions.

Potential resolution: Thoroughly review and address each issue to ensure compliance and successful delivery.",3b7c3fe
Shipping Label Error,"Shipping Label Error Report:

1. Recipient details are incorrect, leading to potential delivery issues. Resolution: Verify and update recipient information.
2. Tracking number is missing or illegible, hindering package tracking. Resolution: Ensure a clear and accurate tracking number on the label.
3. Label print is unclear or smudged, causing readability problems. Resolution: Use high-quality printers and label materials for clear and durable labels.
4. Package weight and dimensions are inaccurate, affecting shipping costs and delivery times. Resolution: Double-check and update package information before generating labels.
5. Return address is outdated or incorrect, causing return shipment problems. Resolution: Maintain up-to-date return address information.
6. Customs information is missing or incorrect, leading to customs delays or rejections. Resolution: Provide complete and accurate customs information for international shipments.
7. Label material does not comply with shipping regulations, potentially causing delivery issues. Resolution: Use compliant label materials for all shipments.
8. Hazardous materials are not properly",2e32bac
Shipping Label Error,"Shipping Label Error Report:

Several issues have been identified with the current shipping label format and process. These include inconsistent formatting, mismatched shipment contents and labels, outdated return addresses, and missing customs documentation. Additionally, there have been instances of noncompliant label material usage, mislabeling of hazardous materials, absence of package orientation indicators, outdated company logos, and lack of special handling instructions. These issues may result in delivery delays, returned shipments, and non-compliance with carrier standards.

To address these problems, it is recommended to establish a standardized shipping label format, ensure accurate shipment contents and label matching, update return addresses and company logos, and provide complete customs documentation. It is also crucial to use compliant label materials, correctly label hazardous materials, include package orientation indicators, and provide clear special handling instructions. Regular audits and employee training can help maintain compliance and prevent future errors.",8eb9c06
Shipping Route Change,"Shipping Route Change Issues:

1. Sudden route alterations and frequent changes cause significant delivery delays and disrupt schedules.
2. Inconsistent route assignments and inefficient changes lead to increased fuel usage and transportation costs.
3. Unplanned deviations from shipping paths and unauthorized modifications result in longer delivery times and raised expenses.
4. Inconsistent application of optimized routes contributes to the aforementioned problems.

Potential Resolution:

A comprehensive route management system could address these issues. This system should include:

- Regular route optimization based on real-time data
- Clear communication protocols for route changes
- Strict access controls for route modifications
- Monitoring and reporting tools to ensure consistent use of optimized routes

By implementing such a system, shipping companies can minimize route changes, reduce delays, and optimize fuel usage, ultimately leading to cost savings and improved delivery times.",fc31347
Shipping Route Change,"Shipping Route Change: Identified Issues and Proposed Resolutions

The identified issues related to shipping route changes include unanticipated alterations, frequent route changes causing delays, inconsistent assignment, and unauthorized modifications. These changes result in increased fuel costs, disrupted delivery schedules, elevated transportation expenses, and inefficient route changes negatively impacting delivery times.

To address these challenges, it is recommended to establish a robust route optimization and management system. This system should ensure consistent application of optimized shipping routes, minimize unauthorized alterations, and provide real-time visibility into route changes. Additionally, implementing a data-driven approach to route planning can help predict potential disruptions and enable proactive decision-making. Regular audits of shipping routes and costs can also help identify inefficiencies and opportunities for improvement.

In conclusion, a comprehensive approach to shipping route management can help mitigate the identified issues and improve overall delivery efficiency and cost-effectiveness.",f81eeb0
Shipping Route Change,"Shipping Route Change: Identified Issues and Potential Resolutions

The unpredictability and frequency of route changes during transit have led to significant delivery delays and disruptions in the supply chain. These changes have resulted in inconsistent route assignments, causing increased fuel consumption and higher transportation costs. Moreover, unauthorized alterations and inefficient route changes have negatively impacted delivery times and overall operational efficiency.

To address these challenges, it is crucial to establish a consistent and transparent route assignment process. This can be achieved by implementing an optimized routing system that minimizes deviations and fuel consumption. Additionally, real-time monitoring and alert systems can help detect and prevent unauthorized route changes, ensuring the integrity of the shipping process.

Furthermore, regular audits and evaluations of the routing system can help identify areas of improvement and ensure that the optimized routes are consistently applied. By addressing these issues, it is possible to enhance the efficiency, reliability, and cost-effectiveness of the shipping process.",5ae0e41
